{
  "schema": "t5.mount.v1",
  "id": "promo-image-set",
  "kind": "skill",
  "name": "홍보 이미지 세트",
  "summary": "우리 가게·서비스 소개 이미지를 인스타 세로판과 홈페이지 가로판 두 벌로 여러 장 만들어 줘요.",
  "version": "0.1.0-draft.1",
  "status": "draft",
  "origin": {
    "type": "ours",
    "modified": false,
    "upstream": null,
    "note": "소개이미지 v3 작업(2026-10-26)에서 쓴 방식을 일반 스킬로 만든 것. 원본은 그 작업 폴더의 스킬/promo-image-set (2026-10-26 13:44 판, zip 18,319바이트). 다듬은 판이 나오면 폴더를 바꿔 넣고 node tools/refresh-files.mjs skills/promo-image-set 로 지문을 다시 적는다."
  },
  "files": [
    {
      "path": "SKILL.md",
      "bytes": 7929,
      "sha256": "e9e69608e5ae21896e7a6b0a073814a09c28421dcd8471089adc721d5f9669f8"
    },
    {
      "path": "references/critique.md",
      "bytes": 2211,
      "sha256": "31d34f18400fefa7c44422047a7015c57976ba613f1f6fa19009fe7b539bdeda"
    },
    {
      "path": "references/design-rules.md",
      "bytes": 5262,
      "sha256": "f6f0a31e26379fadb36a8d83e5c8db1ec7a74ce2819426d6010fa471c5c8ad5b"
    },
    {
      "path": "references/research-and-evidence.md",
      "bytes": 2943,
      "sha256": "df460df35095e48a5f4415bb2d6b9d46270881ac3f22f5a1a266c613f0c81afe"
    },
    {
      "path": "scripts/render.mjs",
      "bytes": 10563,
      "sha256": "eabe39ddd81297fd1ad7c323747490d90f107441ee36a2e228d62dc5ce8b615f"
    },
    {
      "path": "templates/base.css",
      "bytes": 3360,
      "sha256": "0dbf14067dadb9e790d28e11b383e703c1553d7062a690c34bfff23a1dc5006f"
    },
    {
      "path": "templates/slide.html",
      "bytes": 1320,
      "sha256": "d7cb8978a899805f76893154e92db39bab0d5720eef34347b9e1d57ae4de67a9"
    }
  ],
  "license": {
    "spdx": null,
    "decided": false,
    "redistribution": "undecided",
    "upstreamLicense": null,
    "note": "저장소 라이선스 오너 결정 대기(LICENSE-초안.md). 결정 전에는 진열(listed)하지 않는다."
  },
  "permissions": {
    "files": {
      "uses": true,
      "note": "사람이 준 브랜드 그림·자료를 읽고, 정한 결과 폴더에만 새 파일을 써요. 원본 그림은 고치지 않아요. 찍는 동안 쓰는 임시 폴더는 끝나면 지워요."
    },
    "programs": {
      "uses": true,
      "note": "node 로 scripts/render.mjs 를 실행하고, 그 안에서 이 컴퓨터의 크롬·엣지·크로뮴을 화면 없이 띄워 PNG 를 찍어요."
    },
    "internet": {
      "uses": true,
      "note": "1단계 레퍼런스 조사에서 공개 웹페이지를 읽기만 해요(내려받기·로그인 0). 렌더 스크립트 자체는 이 컴퓨터 안(127.0.0.1)의 크롬과만 통신해요."
    },
    "externalSend": {
      "uses": false,
      "note": "만든 이미지를 어디에도 올리거나 보내지 않아요. 게시는 이 방법 밖이고, 부탁하면 채널별 방법으로 따로 이어 가요."
    },
    "money": {
      "uses": false,
      "note": "결제·유료 서비스 사용 없음."
    }
  },
  "platforms": {
    "macos": {
      "supported": true,
      "verified": true,
      "note": "2026-10-26 macOS(Darwin 25.6.0, node 24.14.0)에서 render.mjs --only 01 로 PNG 2장·대조판·휴대폰점검판 생성 확인(약 2초)."
    },
    "windows": {
      "supported": true,
      "verified": false,
      "note": "render.mjs 에 Windows 크롬·엣지 경로가 있으나 Windows 실기 확인 안 함."
    }
  },
  "requires": [
    "크롬·엣지·크로뮴 중 하나",
    "node(티파이브에 들어 있음)",
    "로고·캐릭터 같은 브랜드 그림",
    "기능을 확인할 자료(설명서·실제 결과물)"
  ],
  "t5MinVersion": "2.2.1",
  "review": {
    "date": "2026-10-26",
    "result": "pending",
    "reviewer": "t5-mounts 저장소 준비 세션(Claude Code)",
    "checks": [
      {
        "item": "1. 티파이브가 받아들이나",
        "method": "본선 t5-work-app c53ec733 의 inspectPackageSource(folder·zip 둘 다)와 validateProcedureContent 를 이 폴더와 원본 zip 에 실행",
        "result": "pass",
        "note": "kind=skill, 거절 0, 미지원 부분 0, 스크립트 .mjs 1개, 외부 주소 0, 라이선스 상태 none_declared. 머리말 description 247자(한도 320)."
      },
      {
        "item": "2. 권한",
        "method": "scripts/render.mjs 의 import·spawn·fetch·파일 쓰기 줄을 읽고 SKILL.md 단계와 대조",
        "result": "pass",
        "note": "외부 전송·돈 없음. 프로그램 실행(크롬)은 들일 때 티파이브가 알리는 사실."
      },
      {
        "item": "3. 맥·Windows",
        "method": "맥에서 실제 렌더 1장. Windows 는 코드 경로만 읽음",
        "result": "not_checked",
        "note": "Windows 실기 확인 필요."
      },
      {
        "item": "4. 라이선스",
        "method": "우리 제작물. 저장소 라이선스 오너 결정 대기",
        "result": "not_checked",
        "note": "결정 전 listed 불가."
      },
      {
        "item": "5. 경계(백업 없는 파괴·돈)",
        "method": "SKILL.md·render.mjs 에서 지우기·결제 동작 찾기",
        "result": "pass",
        "note": "지우는 것은 스크립트가 만든 임시 크롬 프로필뿐. 원본은 복사해 쓰고 고치지 않음."
      },
      {
        "item": "6. 비교군 이름 0",
        "method": "SKILL.md·references 를 읽어 다른 제품 이름 찾기",
        "result": "pass",
        "note": "SKILL.md 3단계가 「비교 제품 이름은 넣지 않는다」를 규칙으로 둠."
      },
      {
        "item": "7. 비밀값 0",
        "method": "tools/validate.mjs 의 비밀값 모양 검사(본선과 같은 규칙)",
        "result": "pass"
      },
      {
        "item": "8. 다듬은 판 반영",
        "method": "소개 이미지 세션의 다듬은 판(새 zip) 대기",
        "result": "not_checked",
        "note": "바꿔 넣은 뒤 1~7을 다시 본다."
      }
    ]
  }
}
